title,text,authors,published_date,url,scraped_date
"Who is Carlo Acutis, the computer prodigy who died at 15 and is to be first millennial saint?","He was a London-born teenager with leukaemia who spread his faith by building websites, later gaining the moniker “God’s influencer”.

And now Carlo Acutis, a computer prodigy who died at the age of 15 in 2006, will become the first millennial canonised by the Catholic church next week, in St Peter’s Square.

Acutis used the computer coding languages he learned in primary school to develop websites for his parish and the wider church, including one that tracked Catholic miracles.

The Vatican has a path towards sainthood, which can only begin five years after a person’s death. The Holy See studies the person’s life, and keeps watch for the miracles necessary to secure a spot among the beatific.

Acutis was put on the path after Pope Francis approved a miracle attributed to him: a seven-year-old boy from Brazil recovered from a rare pancreatic disorder after coming into contact with one of Acutis’s T-shirts. A priest had also prayed to Acutis on behalf of the child.

If a person undergoes an unexpected recovery, it can be classed as a miracle by the Vatican. If two miracles are attributed to a deceased person and approved by the pope, then they qualify for sainthood.

Acutis’s sainthood was confirmed when the pope approved the second miracle: a 21-year-old student in Costa Rica made a swift recovery after head trauma from a serious bicycle accident after her mother prayed for her daughter’s recovery at Acutis’s tomb in the Umbrian town of Assisi.

As part of the pathway, Acutis’s body was moved to the hill town of Assisi in central Italy, in line with his last wishes, since he admired Saint Francis.

Acutis was entombed in Santa Maria Maggiore church with a wax mould of his likeness placed over his body, wearing his blue tracksuit top, jeans and trainers.

Ever since, crowds have been gathering at the clear-sided casket. Tens of thousands more are expected to attend the canonisation service on 27 April. Vatican officials hope that the pope, who is recovering from a serious bout of double pneumonia, will preside.

Out of 912 people canonised by Pope Francis, the most recent birth date was previously 1926.

Acutis was born in London in 1991 before moving to Milan with his Italian parents, Andrea Acutis and Antonia Salzano, as a child.

Salzano previously told the newspaper Corriere della Sera that from the age of three her son would ask to visit churches they passed in Milan and would donate his pocket money to poor people in the city.

She said Acutis would also offer to support classmates whose parents were going through divorces, would defend disabled peers when they were bullied and would take meals and sleeping bags to rough sleepers in Milan.

She told Reuters that he was special, but also shared the same anxieties about fitting in as any other teenager: “Carlo was an ordinary child like [others]. He used to play, to have friends, and to go to school. But his extraordinary quality was the fact that he opened the door of his heart to Jesus and put Jesus in the first place in his life.”

She said her son lived an ascetic life in which he would not allow himself more than one pair of shoes at a time.",['Rachel Hall'],2025-04-20,https://www.theguardian.com/world/2025/apr/20/who-is-carlo-acutis-the-computer-prodigy-who-died-at-15-and-is-to-be-first-millennial-saint,2025-04-20
Week in Pictures: From Serbia student protests to anti-US rallies in Yemen,"From the Holy Fire ceremony in Jerusalem’s Old City to displacement in North Darfur, Sudan, here’s the week in photos.",[],2025-04-20,https://www.aljazeera.com/gallery/2025/4/20/week-in-pictures-from-serbia-student-protests-to-anti-us-rallies-in-yemen?traffic_source=rss,2025-04-20
Peaceful picnic marks ‘420 Day’ in Melbourne – ahead of an election where minor parties could play a defining role,"More than a hundred peaceful picnickers gathered on the green grass of Melbourne’s Flagstaff Gardens support of the legalisation of cannabis on Sunday.

This year, the annual 20 April global celebration of cannabis (known as “420”), landed during a federal campaign in which independents and minor parties are expected to play a defining role.

The Legalise Cannabis party’s lead senate candidate for Victoria, Fiona Patten, said the focus of the Sunday event was “celebrating cannabis” and calling for a change to laws that criminalise the use and possession of marijuana for recreational purposes.

It was mostly a relaxed affair. Attendees reclined on blankets beneath a large Moreton Bay fig, as campaigners for the Legalise Cannabis party and the Libertarian party handed out pamphlets and how-to-vote cards. A juggler flipped fluorescent orange clubs into the air, while 50 or so police – and their sniffer dogs – watched from the sidelines.

Patten, who previously represented the Reason party and the Australian Sex party in the Victorian parliament, had not planned to run for federal politics, but she had “unfinished business”, she said, especially in relation to drug law reform.

4:48 Voting 101: Who are the Australian political parties clamouring for your vote? – video

Legalise Cannabis Australia performed strongly at the 2022 federal election, gaining between 2% and 7% of the Senate vote in most states and the Northern Territory, on a platform that seeks to decriminalise and regulate personal use, and see cannabis treated similarly to alcohol and tobacco.

If elected in 2025, Patton hopes to achieve two key actions.

One is a “root-and-branch review” of the medicinal cannabis program and regulations in Australia, addressing the barriers to patients, farmers and manufacturers.

The second is to amend the federal Crimes Act, enabling states and territories to legalise and regulate cannabis without the risk of being overruled by the commonwealth.

“Prime minister Albanese says cannabis regulation is a matter for the states – we have to amend the federal act to enable that to happen,” Patten said.

By running for the Legalise Cannabis party, she also hopes to block candidates such as Ralph Babet, the United Australia party candidate who claimed the sixth Victorian senate seat at the last election.

“I feel really determined to stop that from happening,” she said. “My race is not with the Greens. It’s not with the Labor party. My race is with One Nation and the Trumpet of Patriots.”

In Australia, the use of marijuana for medicinal and scientific purposes has been legal since 2016, whereas recreational use remains largely illegal across much of the country, except for the Australian Capital Territory.

Despite its status, cannabis was the most widely used illicit drug in Australia, used by 11.5% of people, according to the latest data from the Australian Institute of Health and Welfare.

“The fact that 2.4 million of us are using cannabis, yet its prohibited, shows that its a bad law, that discriminates against people and stigmatises people,” Patten said.

More than 80% of Australians aged over 14 did not think possessing cannabis should be a criminal offence, a national survey of more than 21,000 people held in 2022-23 found.

A University of Sydney study, published in the journal Addiction, found rates of cannabis poisoning increased after legalisation in other countries, with risks to children associated with edibles highlighted as a particular concern.

But Patten said legalisation would enable both regulation and education: “One of the main reasons for regulating and legalising a product that is so popular is that you can reduce harm that may be associated with it.”

Many in attendance on Sunday, like Shane Macarthur from Traralgon and Jacob Trounce of Geelong, had travelled long distances to show their support for those fighting to change laws that criminalised recreational use.

Most questioned the visible presence of police. Sharon Tavener, from Frankston, said she thought the police were intimidating and unnecessary, when what people wanted was the ability to come together peacefully, have a joint and enjoy each other’s company.",['Petra Stock'],2025-04-20,https://www.theguardian.com/australia-news/2025/apr/20/peaceful-picnic-marks-420-day-in-melbourne-ahead-of-an-election-where-minor-parties-could-play-a-defining-role,2025-04-20
Ukraine Says Russia Violated Easter Truce,"Russian troops continued fighting along the front lines despite Moscow’s announcement of a 30-hour Easter cease-fire, Ukrainian authorities said Sunday morning, although the war was still relatively quiet overnight.

Russian troops fired artillery almost 450 times between 6 p.m. Saturday, when the cease-fire was supposed to have started, and 6 a.m. Sunday, President Volodymyr Zelensky of Ukraine said in a social media post. He also said that the Russians had launched 24 assaults and used drones more than 300 times. Most of the action took place in the first six hours of the truce, on Saturday evening.

In another social media post, Mr. Zelensky said that the cease-fire was not in effect in Russia’s Kursk and Belgorod regions, where Russia is trying to recapture territory taken by Ukraine.",['Kim Barker'],2025-04-20,https://www.nytimes.com/2025/04/20/world/europe/ukraine-russia-easter-truce.html,2025-04-20
Gaza father grieves for children killed in Israeli airstrike on church building,"As people take a break for the Easter holiday, in the Gaza Strip there is no respite from the 18-month-long war with Israel.

Gaza has a tiny Christian community of Greek Orthodox Christians, Catholics, Evangelicals, and Anglicans.

For Ramez al-Souri, the pain is unimaginable. His three children were killed by an Israeli airstrike, on an annex of Gaza's Saint Porphyrius Greek Orthodox Church.

Palestinian health officials say the attack on 19 October 2023 killed 18 people inside the building.

""My home has changed completely because there are no smiles, no laughter, no joy,"" Mr Al-Souri says.

""I lost my flower - my daughter Julie - and my boys Suhail and Majd. They were salt of the Earth.""

Shrouded in darkness

Julia was 12 years old, Suhial 14 and Majd 11.

It is a loss that never leaves Mr Al-Souri, and one shared by almost every family in Gaza.

Walking through the cemetery, he gently places a small bouquet of flowers on his children's grave. Gunfire crackles in the distance. The neighbourhood is full of rubble and destruction.

""This Easter is no different than the last,"" Mr Al-Souri says.

""We are tending to our wounds.

""We continue to hope for an end to this war and suffering, for the darkness over Gaza to finally lift.""

Read more:

How two hours of terror unfolded

Please use Chrome browser for a more accessible video player 1:28 Sky reveals timeline of IDF's Gaza aid attack

No end in sight

But there is no sign of light for more than two million people trapped inside Gaza.

Israel's Prime Minister Benjamin Netanyahu gave a special address to the nation on Saturday night and vowed to continue the war until Hamas is destroyed.

Mr Netanyahu said Israel has ""no choice"" but to keep fighting ""for our very own existence until victory.""

Be the first to get Breaking News Install the Sky News app for free

Israel is calling for Hamas to disarm and to release 10 Israeli hostages in exchange for a 45-day ceasefire.

There are 59 hostages still inside Gaza. It is believed 24 of them are still alive.

Hamas has rejected the proposal. It argues Israel reneged on the first ceasefire deal by refusing to move to phase two of the agreement and withdraw Israeli troops from the Gaza Strip.

Please use Chrome browser for a more accessible video player 0:38 Netanyahu: 'I will not give in'

A disaster on the ground

Since the ceasefire collapsed on 2 March, Israel's bombing campaign has intensified.

Palestinian health officials say more than 1,700 people have been killed in the last month, and more than 90 people in the last 24 hours.

The humanitarian situation is a disaster. At the few remaining soup kitchens in Gaza, children scramble for food. They carry pots for their family and push forward trying to secure a bowl of lentils or rice.

Israel has blocked aid trucks from entering for the last seven weeks. It says it is to put pressure on Hamas.

But the pressure is being felt by civilians, creating what aid groups say is the most severe crisis Gaza has ever faced.

Israel has cut off vital supplies of food and medicine, but insists it is not using starvation as a weapon of war. It rejects any suggestion Gaza does not have enough food and accuses Hamas of stealing it.

Please use Chrome browser for a more accessible video player 3:36 Gazans struggle to find bodies under rubble

'We're craving food'

Seven members of the Al-Asheh family are displaced and live in a tent in Deir al-Balah.

Twelve-year-old Ahmed says before the war he didn't like lentils, now it is all he eats.

""Before the war, we used to have fruits, chicken, vegetables, everything was available. We were never hungry,"" Ahmed explains.

""Now, we're craving food, chicken - anything. The only thing we can eat now is what the soup kitchen provides.""

Image: Food is increasingly hard to come by in Gaza

It is clear that ceasefire talks are going nowhere, and Israel has tightened its blockade and deepened its war.

More than 400,000 Palestinians have recently been displaced yet again as Israel has expanded a buffer zone inside Gaza, levelling houses to create a ""security zone"".

For Palestinians, this constitutes a ""land grab"".

Please use Chrome browser for a more accessible video player 0:33 Israeli forces encircle Rafah

'A symbol of the world's conscience'

Israel has also established another military corridor in southern Gaza, calling it Morag corridor.

The corridor is north of Rafah and has cut Gaza's second-largest city off from the rest of the territory. Israel says it has now taken control of 30% of the Gaza Strip and insists it will not withdraw.

For Palestinians, the future has never looked more bleak. They are blockaded, displaced, struggling for food, water, basic sanitation and in constant search of safety.

""Gaza is calling on the world to stand by it,"" Mr Al-Souri says.

""Gaza stands as a symbol of the world's moral conscience.""","['Sky Uk Limited', 'Nicole Johnston', 'News Correspondent']",,https://news.sky.com/story/father-grieves-for-children-killed-in-israeli-airstrike-on-church-building-in-gaza-13352247,2025-04-20
Gunmen in fake army uniforms shoot 12 dead at Ecuador cockfight,"Gunmen shoot 12 dead at Ecuador cockfight

Police in Ecuador say they have arrested four people in connection with an attack by gunmen at a cockfighting ring in which 12 people died.

Weapons and replica police and army uniforms were seized during police raids in the north-western Manabí province on Friday - a day after the attack in the rural community of La Valencia.

Footage of the attack shared on social media showed gunmen entering the ring and opening fire, as terrified spectators dived for cover.

Reports in local media suggested the attackers in fake military gear were members of a criminal gang whose rivals were at the cockfight.",[],,https://www.bbc.com/news/articles/cm241v1w2vro,2025-04-20
Thousands gather for centuries-old Holy Fire ceremony in Jerusalem,"Thousands of Christians gathered in the cavernous Church of the Holy Sepulchre for a centuries-old Holy Fire ceremony.

Holding unlit candles, they packed into the sprawling 12th-century basilica built on the site where, according to tradition, Jesus was crucified and buried.

In near-total darkness, the Greek patriarch entered the Holy Edicule and emerged with two lit candles. The flame was passed from one candle to the next, the light overcoming the darkness in the rotunda. The flame was later transferred to Orthodox communities in other countries on special flights.

Eastern Orthodox Christians believe the light miraculously appears inside the Holy Edicule, built on the traditional site of Jesus’s tomb, while sceptics going back to the Middle Ages have dismissed it as a carnival trick for the masses.

Either way, the ceremony, which goes back at least 1,200 years, is a sight to behold. It has also ignited safety concerns.

In 1834, a frenzied stampede broke out in the darkened church, and the ruler of the Holy Land at the time barely escaped after his guards drew swords and hacked their way through the crowd, historian Simon Sebag Montefiore recounts in his history of Jerusalem. Some 400 pilgrims died in the melee, most from suffocation or trampling.

Advertisement

Israeli authorities have sought to limit participants in recent years, citing safety concerns. That has drawn protests from church leaders, who have accused them of upsetting the delicate, unwritten arrangements around Jerusalem’s holy sites known as the status quo.

On Saturday, there was a heavy military presence as thousands of worshippers passed through Israeli checkpoints to enter.

Some worshippers lamented that the turnout lacked numbers this year because of Israel’s 18-month war on Gaza. “The number of police is higher than the number of pilgrims,” said Adeeb Joude, key holder for the Holy Sepulchre.

Israel captured East Jerusalem, including the Old City with major sites sacred to Jews, Christians and Muslims, in the 1967 Middle East War, and annexed it in a move not recognised internationally. The Palestinians want East Jerusalem to be the capital of their future state.

The Old City has a long history of tensions between Israelis and Palestinians, among different religious groups that share its hilly confines and even within certain faiths. Perceived infringements on the status quo in the Church of the Holy Sepulchre have led to brawls between monks of different denominations.

Israel says it is committed to ensuring freedom of worship for Jews, Christians and Muslims, and has long presented itself as an island of tolerance in the Middle East.

In recent years, however, tensions have risen with the local Christian community, most of whom are Palestinian Christians, a population that has dwindled through decades of conflict as many have moved abroad.",[],2025-04-20,https://www.aljazeera.com/gallery/2025/4/20/thousands-gather-for-centuries-old-holy-fire-ceremony-in-jerusalem?traffic_source=rss,2025-04-20
US air strikes pound Yemen,"NewsFeed US air strikes pound Yemen

Video shows US air strikes pounding Yemen’s capital, Sanaa, just days after the US bombed Hodeidah’s airport and Ras Isa port, killing at least 80 people. The UN says it’s gravely concerned by the US campaign against the Iran-backed group, which the Trump administration argues is necessary to protect international shipping in the Red Sea.",[],2025-04-20,https://www.aljazeera.com/program/newsfeed/2025/4/20/us-air-strikes-pound-yemen?traffic_source=rss,2025-04-20
The Business Playbook for Tariff Chaos,"That kind of loss is easier to stomach if it’s a one-time thing.

Lee Mayer manages Havenly, a collection of home décor brands. To mitigate tariff risk, she has been working for months to relocate her production to Vietnam and Cambodia from China. But one last shipment didn’t make it out of China before the new duties hit. The boat is now on its way to the United States, and it will carry a tariff bill of at least $2 million when it arrives.

“It’s pretty painful,” Ms. Mayer said. “That’s two to three million we won’t be able to reinvest elsewhere.” She’s just hoping that tariffs on the countries that now make her furniture won’t end up going into effect after Mr. Trump’s 90-day pause. “I’m a bit worried that it’s just a game of Whac-a-Mole at this point,” she said.

Batten down the hatches

Even for those with healthy profits, paying more in tariffs generally means spending less on something else. That could mean deciding to not lease a larger space, pay for advertising, buy new equipment or hire a new sales associate.

Some can cut costs through automation. Others will end up letting people go. Kelsey O’Callaghan is one of the owners of a company, Dorai Home, that imports kitchen and bathroom products made from a special quick-drying material from China, and she has searched fruitlessly for viable suppliers in the United States. To prepare for an enormous tariff bill, she has cut the hours of many of her call center contractors and creative agencies and even some core staff members.

“We did have to reduce the size of our team slightly, which, as a founder, is a tough thing because you see not only how hard people are working,” Ms. O’Callaghan said, “but you are also aware of risk of burnout or more errors happening as other people absorb roles.”",['Lydia Depillis'],2025-04-20,https://www.nytimes.com/2025/04/20/business/economy/tariffs-business-strategy.html,2025-04-20
Inside the Urgent Fight Over the Trump Administration’s New Deportation Effort,"On Thursday evening, lawyers helping Venezuelan immigrants most at risk of being removed under an 18th-century wartime powers act received an ominous alert: U.S. immigration officials were handing out notices at a detention facility in Texas, informing migrants that they were considered enemies under the law and would be removed from the country.

“I am a law enforcement officer authorized to apprehend, restrain and remove alien enemies,” read the notice, a copy of which was filed in federal court by the American Civil Liberties Union. “Accordingly, under the Alien Enemies Act, you have been determined to be an alien enemy subject to apprehension, restraint and removal from the United States.”

The notice said the migrant could make a phone call but did not specify to whom. The single-page notice also did not mention any way to appeal the order.

The Supreme Court ruled this month that migrants must receive advance notice that they are subject to removal under the rarely invoked wartime powers law — and that they must have an opportunity to challenge their removal in court.","['Hamed Aleaziz', 'Alan Feuer', 'Annie Correal']",2025-04-19,https://www.nytimes.com/2025/04/19/us/politics/trump-deportation-courts-venezuelan-migrants-texas.html,2025-04-20
