title,text,authors,published_date,url,scraped_date
Tunisian court hands prison sentences of up to 66 years in mass trial of regime opponents,"A Tunisian court has handed down prison sentences of 13 to 66 years to politicians, businessmen and lawyers in a mass trial that opponents say is fabricated and a symbol of president Kais Saied’s authoritarian rule.

Businessman Kamel Ltaif received the longest sentence of 66 years on Saturday, while opposition politician Khayam Turki was given a 48-year jail term, a lawyer for the defendants said.

The court also sentenced prominent opposition figures, including Ghazi Chaouachi, Issam Chebbi, Jawahar Ben Mbarek and Ridha Belhaj, to 18 years in prison. They have been in custody since 2023.

Forty people were being prosecuted in the trial that started in March. More than 20 have fled abroad since being charged.

Saied secured a second five-year term in 2024 with 90.7% of the vote after coming to power in 2019. Rights groups say he has had full control over the judiciary since he dissolved parliament in 2021 and began ruling by decree. He dissolved the independent supreme judicial council and sacked dozens of judges in 2022.

“We are not surprised by these unjust and vengeful verdicts that seek to silence the voices of these opposition figures,” Chaouachi’s son Youssef said

“I have never witnessed a trial like this. It’s a farce, the rulings are ready, and what is happening is scandalous and shameful,” said defence lawyer Ahmed Souab on Friday before the ruling was handed down.

Authorities say the defendants, who also include former officials and the former head of intelligence Kamel Guizani, tried to destabilise the country and overthrow Saied.

“The authorities want to criminalise the opposition,” said the leader of the main National Salvation Front opposition coalition, Nejib Chebbi, on Friday. Chebbi was also among the defendants.

Saied said in 2023 the politicians were “traitors and terrorists” and that judges who would acquit them were their accomplices.

The opposition leaders involved in the case accuse Saied of staging a coup in 2021 and say the case is fabricated to stifle the opposition and establish a one-man, repressive rule.

They say they were preparing an initiative aimed at uniting the fragmented opposition to face the democratic setback in the cradle of the Arab spring uprisings.

Most of the leaders of political parties in Tunisia are in prison, including Abir Moussi, the leader of the Free Constitutional party, and Rached Ghannouchi, the head of Ennahda – two of Saied’s most prominent opponents.",[],2025-04-20,https://www.theguardian.com/world/2025/apr/20/tunisia-court-prison-sentences-kais-saied,2025-04-20
Zelenskyy accuses Putin of creating ‘impression’ of a ceasefire and says Russian shelling has continued – Ukraine war live,"08.30 BST Zelenskyy accuses Russia of creating an 'impression' of a ceasefire as shelling on Ukraine continues

Welcome back to our live coverage of Russia’s war on Ukraine.

Ukrainian President Volodymyr Zelenskyy has accused Russia of creating a mere “impression” of a ceasefire as Moscow reportedly continued shelling areas of Ukraine overnight.

In a televised meeting with his commander-in-chief on Saturday, Russian President Vladimir Putin said the temporary ceasefire would last from 6pm Moscow time (4pm BST) on Saturday until midnight (10pm BST) on Sunday.

Putin claimed he had ordered his forces to “stop all military activity” along the frontline during this window for “humanitarian reasons”.

1:01 Putin declares temporary Easter ceasefire in Ukraine – video

But Zelenskyy said there had been hundreds of instances of shelling on Saturday evening. Early on Sunday, Ukrainian forces reported 59 instances of shelling and five assault attempts along the frontline, he said.

In a post on X, the Ukrainian president wrote:

Overall, as of Easter morning, we can state that the Russian army is attempting to create the general impression of a ceasefire, while in some areas still continuing isolated attempts to advance and inflict losses on Ukraine. Russia must fully comply with the conditions of the ceasefire. Ukraine’s proposal to implement and extend the ceasefire for 30 days after midnight tonight remains on the table. We will act in accordance with the actual situation on the ground.

Previous attempts at holding ceasefires for Easter in April 2022 and Orthodox Christmas in January 2023 were not implemented after both sides failed to agree on them.

The aftermath of a Russian attack on the frontline town of Kostiantynivka in the Donetsk region of eastern Ukraine.

Photograph: Ukrainian Armed Forces/Reuters

In some other developments:",['Yohannes Lowe'],2025-04-20,https://www.theguardian.com/world/live/2025/apr/20/ukraine-russia-zelenskyy-putin-war-easter-truce-impression-ceasefire-live-latest-updates,2025-04-20
6 Killed as Giant Waves Batter Australia,"At least six people died in Australia as towering waves battered Sydney and other places along the country’s east coast over the Easter holiday weekend, the police said.

A low pressure system brought powerful surf starting Friday, and waves taller than 24 feet were recorded off the coast of Brisbane in the state of Queensland on Friday, according to government data.

Australia’s meteorological agency had issued a warning for hazardous surf for a long stretch of coast from Queensland to New South Wales that includes Sydney, Byron Bay and the Gold Coast, and cautioned that conditions could be dangerous for rock fishing, boating and swimming.

By the time the hazardous surf warning was lifted on Sunday, five people had died in New South Wales, including in Sydney, and another in the state of Victoria, officials said. Another two people were missing.",['Yan Zhuang'],2025-04-20,https://www.nytimes.com/2025/04/20/world/asia/australia-waves-queensland-sydney.html,2025-04-20
How to dismantle democracy: Lessons aspiring autocrats may take from Hungary's Orban,"How to dismantle democracy: Lessons aspiring autocrats may take from Hungary's Orban

toggle caption Rob Schmitz/NPR

BUDAPEST, Hungary — Atop a cobblestone hill overlooking the Danube River and the medieval lanes of Budapest, tour groups surround a changing of the guard ceremony in front of a 13th century baroque castle. Across the square, construction crews rebuild a centuries-old palace complex, and that's where politician Akos Hadhazy guides a tour of his own. ""We are at the Buda Castle, and if you're looking for a symbolic place for corruption, power and the waste of public money, this is a beautiful venue for that,"" Hadhazy says as a Chinese tour group shuffles by.

Hadhazy, who works as a veterinarian, is an independent member of Hungary's parliament. He routinely gives tours showcasing what he and many critics allege is the corruption of Hungarian Prime Minister Viktor Orban's government.

Sponsor Message

""The offices for the prime minister and his cabinet used to be down there next to the parliament building,"" he continues, pointing to Budapest's other big pointy-towered tourist attraction in the distance, across the river. ""But Orban decided he wanted to move here, into a castle. Even Matyas Rakosi, Hungary's most brutal communist dictator, refused to move his office here, but Orban wants to play king, so the national gallery will eventually need to be moved out of the castle to make way for him.""

All this construction, Hadhazy says, motioning to the cranes towering above the hilltop, represents Orban's gifts to cronies in the form of lucrative contracts while ensuring Orban can survey his ""kingdom"" from above the capital.

Orban, 61, is in his fourth consecutive term as prime minister. In that time, he and his allies have dismantled democratic checks and balances, taken control of the country's media, civil society and universities, and consolidated power in himself and his Fidesz party. The dismantling of Hungary's democracy is a point of fascination for political scientists around the world — including those advising the Trump administration.

toggle caption Rob Schmitz/NPR

But Hadhazy says the Hungarian prime minister is an easy read. ""It's not like Orban is a genius politician,"" he says. ""He received his sheet music from Vladimir Putin, who came into power when oil prices were high, and he channeled that money into oligarchs and in return they bought up Russia's independent media. Orban franchised that model here in Hungary, except he used European Union funds.""



Sponsor Message

Orban targets the media

The EU began freezing those funds in 2022, but not before Orban and loyal associates took control of much of the country's media.

When the Fidesz party regained power in 2010, ""the first target was the media,"" explains Hungarian investigative journalist Andras Petho. ""Literally the first legislation that they introduced to the parliament was the media law, which, at first, was about redesigning the media regulatory system.""

Petho, who now runs the investigative reporting center Direkt36 in Budapest, says Orban's government was quick to approve any business deal by those close to Orban who wanted to take over media companies. At the same time, Petho says, Orban changed the structure of Hungary's public media outlet, allowing the government to purge the institution of anyone deemed unfriendly to the government.

Petho's former employer Origo, a digital news site, was also sold to a company owned by the son of the then-central bank governor, who, Petho says, eventually turned it into a propaganda site. ""The publisher started coming to us with really unusual requests, asking us to remove articles from the website, and when we tried to push back, things escalated pretty quickly.""

toggle caption Rob Schmitz/NPR

Petho says he and many others in Origo's newsroom resigned.

What's left of Hungary's free press can be found in nooks and crannies that dot the capital. In a tiny apartment in central Budapest, a few dozen journalists from what used to be prominent newspapers that were, one-by-one, forced to shut down by Orban's government have formed their own newspaper — Magyar Hang, or Hungarian Voice.

""Nobody was brave enough to print in Hungary, so we have to find a printing company outside the country,"" says Csaba Lukacs, managing director of the weekly paper. ""Our newspaper is printed in Slovakia in Bratislava, so we have to organize each week the transportation of the paper.""

Sponsor Message

Hungarian Voice is funded almost entirely through subscriptions, says Lukacs. He says it's the only conservative paper in Hungary that isn't part of the state propaganda apparatus. ""We are not receiving advertising even from multinational companies,"" he says, ""because they are afraid they will be punished by the tax authorities or somebody else, and our journalists are not allowed to go to the government press conferences.""

Lukacs says the government has stripped away press freedom in a step-by-step process over the years.

""We are not yet in Turkey, because the journalists will not be jailed yet,"" he says. ""We are not in Russia because nobody is falling out from the windows yet. But day by day we are getting closer.""

Pressure on Hungary's universities

""What are the characteristics of a dictatorship,"" asks professor Agnes Kende to her students, mostly middle-aged adults at a night class inside a sleek room in Central European University's Budapest campus.

""One person controls power with their family,"" offers Éva Turonyi, a retired healthcare assistant.

""Very good,"" says Kende, writing the point on the board.

""In a dictatorship, the power is centralized, while in a democracy, it's more fragmented,"" says Andrea Kovacs, an assistant at a local construction company.

""Great, centralized power,"" echoes Kende.

""In a dictatorship, elections are made irrelevant,"" offers one of the only men in the class, Jeno Bak.

""Interesting point,"" says Kende. ""Let me ask: Does anyone in a dictatorship have the right to vote?""

toggle caption Rob Schmitz/NPR

Bak, in his 60s, shoots up his hand and Kende calls on him. ""I had the right to vote, even in the Kadar era,"" he says, referring to communist dictator Janos Kadar, who ruled Hungary for 32 years during the Cold War. ""It didn't have much of a point because you only could pick from a single option. We acted out the 'democracy.' ""

Sponsor Message

After the brainstorming session, the class breaks into small groups, where they analyze key speeches delivered by Stalin, Hitler, Mao, and other dictators throughout modern history. The class is part of the Socrates Program at Central European University, one of the few programs still offering classes at the institution's Budapest site. CEU was forced to move its degree programs from Budapest to a new campus in Vienna after Orban's government pushed a law through parliament in 2017 that changed rules for foreign universities operating in Hungary.

""In spite of everything,"" says CEU Budapest Pro-Rector Laszlo Kontler, ""we are determined to continue useful work here with all civil society stakeholders, academic partners that have been accumulated over three decades, and with whom the connections are not completely lost.""

Kontler, a history professor, says Orban's government has not only forced out foreign universities like CEU, but in the 2010s, it took over state universities by appointing chancellors who had a wide scope of authority over the institutions' finances. ""So that's one step,"" Laszlo says, ""if you will, against the academic autonomy of institutions.""

toggle caption Rob Schmitz/NPR

Another step, he says, was, under the direction of Orban, state universities ""were privatized in a very particular way"" — placed under the direction of boards that were packed with individuals close to Orban's Fidesz party. ""They have been promised to be put on a financially more viable footing in exchange for accepting basically control or surveillance by a combination of individuals and forces close to the government,"" explains Laszlo.

The institutions that accepted this government control include some of Hungary's oldest and largest universities such as Corvinus University, Moholy-Nagy University of Art and Design, and Semmelweis University.

""There are excellent academics who are doing academically credible work at these universities as well,"" Kontler points out, ""but still, there are strange things happening, which, if one puts it together, cannot be regarded as anything else than an infringement on academic authority.""

Sponsor Message

""Trump went further in two months than Orban could in 15 years""

This year, faced with an increasingly unified opposition in parliament that has rallied behind charismatic lawyer and politician Peter Magyar, Orban's attacks on media, civil society and freedom of assembly have gained momentum. On March 15, in a speech commemorating Hungary's 1848 revolution against the Habsburg empire, Orban said, ""We are dismantling the financial machine that has used corrupt dollars to buy politicians, judges, journalists, bogus civil society organizations and political activists.""

toggle caption Balint Szentgallay/NurPhoto via Getty Images

He called these groups stink bugs who have ""survived the winter"" and need to be eradicated. ""If there is justice, and there is, there is a special place in hell for them,"" Orban said.

Political scientist Peter Kreko says Orban is targeting the last bastions of Western democracy in Hungary. ""Orban just thinks that the West is unable to survive and the democratic and liberal practices of the West have weakened the West,"" he says.

Kreko has mapped out the 15-year process Orban has taken to dismantle Hungary's democracy. Orban began, he says, by weakening Hungary's courts, filling them with loyalists. He then applied pressure on media companies, either turning them into state propaganda or putting them out of business. Then, says Kreko, Orban took control over universities, appointing leaders loyal to him.

Kreko says Orban focused on ridding Hungary of any institution capable of checking his power, and he says he sees similarities to how President Trump is carrying out his second term in office. The difference, says Kreko, is the pace at which Trump is operating. ""I think Trump went further in two months than Orban could in 15 years,"" observers Kreko. ""In the United States, it reminds me of a constitutional coup, where everything happens very rapidly.""

In public speeches, Trump has called Orban ""fantastic,"" ""respected"" and said ""nobody is a better leader"" than the Hungarian prime minister. And while Orban has boasted that his party has shared his strategies with Trump advisers, Kreko doubts the help was very meaningful. He says Hungary serves as more of a conservative fantasyland that MAGA Republicans can aspire to. ""So: Hungary as the country where you don't have immigrants, where you don't have woke issues, where gender ideology is not that dominant,"" says Kreko, ""and where family values are strong. So this is clearly a construction of Hungary that has nothing to do with reality.""

toggle caption Rob Schmitz/NPR

He says that's because Hungary is surrounded by Europe and its open society. Budapest's annual Pride Parade, one of Europe's largest, is now in the Hungarian government's crosshairs. In March, it pushed a new law through parliament that banned any assembly that ""promotes homosexuality,"" asserting it was needed to ""protect children."" On April 14, the parliament voted to amend the country's constitution with similar language.

At a café in Budapest, Pride Parade spokesperson Johanna Majercsik says this new law will likely go further than banning the pride parade. ""If the government succeeds in banning such a peaceful protest, that means that in the future they will be able to ban or restrict any other peaceful event, any other peaceful demonstration organized by [other] social groups,"" she says.

Many other Hungarians agree. After the public assembly law passed in March, tens of thousands of people halted traffic and bridges in the capital in what have become weekly protests in Budapest. Critics of the law and the new constitutional amendment say Orban is using the LGBTQ+ community as a tool to shut down the right of Hungarian citizens to freely assemble in peaceful protests, particularly at a time when the opposition to Orban's rule is beginning to gain momentum.

Sponsor Message

But political analysts say Orban, nearing the end of his fourth consecutive term, appears to be, yet again, adapting his step-by-step strategy to hold on to power for as long as he can.

Mate Halmos contributed reporting to this story from Budapest.",['Rob Schmitz'],2025-04-20,https://www.npr.org/2025/04/20/nx-s1-5338596/hungary-viktor-orban-democracy,2025-04-20
"Soyuz MS-26 spacecraft brings NASA, Russia astronauts back to earth","Landing on the steppes of Kazakhstan coincides with US astronaut Donald Pettit’s 70th birthday.

Russian astronauts Alexey Ovchinin and Ivan Wagner have returned to Earth along with American Donald Pettit after a seven-month science mission on board the International Space Station (ISS).

The Russian Soyuz MS-26 spacecraft carrying the trio touched down southeast of the town of Dzhezkazgan, Kazakhstan, at 6:20am (01:20 GMT) on Sunday, the landing confirmed by the United States’s NASA and Russia’s Roscosmos space agency.

The timing of their parachute-assisted return to Earth coincided with the US astronaut’s 70th birthday, NASA said on the social media platform X.

Happy birthday, @astro_Pettit! Many happy returns (including this one) 🥳 The MS-26 Soyuz spacecraft touched down in Kazakhstan at 9:20pm ET—or, in local time, 6:20am April 20, Pettit's 70th birthday. pic.twitter.com/qFM5fAxnA0 — NASA (@NASA) April 20, 2025

NASA said the crew was moved to a recovery staging area in the city of Karaganda, adding that Pettit was doing well.

The crew arrived on the orbiting ISS laboratory on September 11, 2024, spending 220 days in space during which they orbited the Earth 3,520 times, completing a journey of 93.3 million miles (150.15 million km), NASA said in a statement.

Advertisement

Pettit spent his time researching “in-orbit metal 3D printing capabilities” and “water sanitisation technologies” while exploring plant growth and fire behaviour in space.

This was Pettit’s fourth spaceflight, with a total of 590 days in orbit logged throughout his career. Ovchinin has notched up 595 days in space over four flights, while Wagner has reached a total of 416 days over two flights.

Space exploration has remained a rare avenue of cooperation between the US and Russia since the latter unleashed its war in Ukraine in February 2022.

Earlier this month, the Soyuz MS-27 spacecraft carried another US-Russia crew – NASA’s Jonathan Kim and Russian crewmates Sergei Ryzhikov and Alexei Zubritsky – to carry out scientific experiments on the ISS.

However, the US and other Western countries have ceased other partnerships with Roscosmos as part of a slew of sanctions placed on Russia over the war.

Astronauts, who are trained and certified by NASA and others like the European Space Agency, are known as cosmonauts when they represent Roscosmos.",[],2025-04-20,https://www.aljazeera.com/news/2025/4/20/soyuz-ms-26-spacecraft-brings-us-russia-crew-back-to-earth?traffic_source=rss,2025-04-20
Oldest serving US astronaut returns from space on 70th birthday,"America's oldest serving astronaut has touched down on Earth on his 70th birthday.

NASA astronaut Donald Pettit and two Russian cosmonauts had been on a seven-month mission to the International Space Station (ISS).

The Soyuz MS-26 spacecraft carrying Mr Pettit and Russians Alexey Ovchinin and Ivan Vagner landed in Kazakhstan on Sunday.

""Its deorbiting and descent to Earth were normal,"" Russia's Roscosmos space agency said.

Image: The Soyuz MS-26 spacecraft returning to Earth. Pic: AP

The crew's seven-month science mission started on 11 September 2024. They orbited the Earth 3,520 times over 220 days in space.

Read more from Sky News:

Robots race half-marathon against humans for first time

How Japan could shape the future of the NHS

Warning over exploitation of 'influencer' children

Image: The spacecraft lands in Kazakhstan. Pic: AP

Mr Pettit had been conducting research to enhance in-orbit metal 3D printing capabilities, advance water sanitisation technologies, explore plant growth under varying water conditions and investigate fire behaviour in microgravity, according to NASA.

It was the fourth time in space for Mr Pettit and Mr Ovchinin, while it was Mr Vagner's second spaceflight.",['Sky Uk Limited'],,https://news.sky.com/story/touch-down-iss-crew-returns-after-seven-months-in-space-13352239,2025-04-20
